slug,name,url,desc,button,nickname,fungi,nsfw
ink,Shroom.Ink,https://shroom.ink/,The webring owner's mushroom themed personal site.,Shroom.Ink.gif,Rodrick,Inky Cap,n
egg,Screaming Egg,https://screamingegg.neocities.org/,pseud central,,screamingegg,Zombie Ant Fungi,n
darylsun,Daryl Sun's Journal,https://blog.darylsun.page,An online diary of a lady's misadventures in two worlds,DarylSun.webp,Daryl,Shelf Fungi,n
ren,abyssal,https://leviathren.neocities.org/,Personal collections in a dark expanse.,ABYSSALbtn.gif,Leviathren,Pixie's Parasol,n
forever,foreverliketh.is,https://foreverliketh.is/,Both blog and digital garden.,foreverliketh.is.png,foreverliketh.is,Candlestick Fungus,y
asralore,Asralore,https://asralore.neocities.org/,A collection of surreal art,Asralore.gif,Asralore,Russula Emetica,y
primordial,Primordial Dungeon,https://nymphblood.neocities.org/,A castle that exists in my pineal gland,primordial_dungeon.gif,Lady Nymph,Devil's Tooth,n
finnialla,Finnialla's Website,https://finn-all-uh.org,"I'm Finnialla, an aspiring non-binary screenwriter, novelist, poet, and artist who makes trash left in back alley dumpsters and Denny's parking lots at 2 a.m.",Finnialla.jpeg,Finnialla,Pink Oyster,y
corvidae,corvidae.digital,https://corvidae.digital/,"my personal digital space! features my art, blog, collections, and more! :D",corvidae_digital.gif,corvidae,Entomopathogenic Fungi,n
aster,Aster's Asterisms,https://asters-asterisms.neocities.org/,an electic collection of essays and shrines :D,astersasterisms.gif,aster,Tetrapyrgos nigripes,n
raven-files,Raven Files,https://raven-files.neocities.org/shinies,"a slightly random,gothy personal site",,Mercy,True Morel,n
noisecorvid,NoiseCorvid,https://noisecorvid.neocities.org/,A digital playground of a horror-obsessed crow.,,Noise,Puffball,y
zest,zestpunk,https://zestpunk.nekoweb.org/,The personal site of zestpunk. Art and occassional rambling if you're into that.,,zest,Fly Agaric,y
mametzwood,mametzwood,https://mametzwood.neocities.org,"a wunderkammer full of thoughts and old things",mametzwood.png,will,"Coprinus comatus",n
benitengu,紅天狗,https://benitengu.neocities.org/,"Personal website where I talk about the occult, horror, politics, and animals",benitengu.png,worm,amanita muscaria,y
